{
  "$ref": "#/definitions/activities",
  "definitions": {
    "activities": {
      "type": "object",
      "properties": {
        "key": {
          "type": "string"
        },
        "lang": {
          "type": "string",
          "enum": [
            "fr",
            "en",
            "it"
          ]
        },
        "slug": {
          "type": "string"
        },
        "route": {
          "type": "string"
        },
        "title": {
          "type": "string"
        },
        "description": {
          "type": "string"
        },
        "alternates": {
          "type": "object",
          "properties": {
            "fr": {
              "type": "string"
            },
            "en": {
              "type": "string"
            },
            "it": {
              "type": "string"
            }
          },
          "additionalProperties": false,
          "default": {}
        },
        "breadcrumb": {
          "type": "array",
          "items": {
            "type": "object",
            "properties": {
              "label": {
                "type": "string"
              },
              "href": {
                "type": "string"
              }
            },
            "required": [
              "label"
            ],
            "additionalProperties": false
          },
          "default": []
        },
        "image": {
          "anyOf": [
            {
              "type": "object",
              "properties": {
                "src": {
                  "type": "string"
                },
                "alt": {
                  "type": "string"
                }
              },
              "required": [
                "src",
                "alt"
              ],
              "additionalProperties": false
            },
            {
              "type": "null"
            }
          ]
        },
        "paragraphs": {
          "type": "array",
          "items": {
            "type": "string"
          },
          "default": []
        },
        "activityName": {
          "type": "string"
        },
        "backLabel": {
          "type": [
            "string",
            "null"
          ]
        },
        "backUrl": {
          "type": [
            "string",
            "null"
          ]
        },
        "bookingLabel": {
          "type": [
            "string",
            "null"
          ]
        },
        "$schema": {
          "type": "string"
        }
      },
      "required": [
        "key",
        "lang",
        "slug",
        "route",
        "title",
        "description",
        "activityName"
      ],
      "additionalProperties": false
    }
  },
  "$schema": "http://json-schema.org/draft-07/schema#"
}