{
  "key": "/activites/visiter-les-villages-perches/",
  "lang": "fr",
  "slug": "visiter-les-villages-perches",
  "route": "/activites/visiter-les-villages-perches",
  "title": "Les villages perchés de l'arrière pays niçois | Mas du chanoine",
  "description": "C'est dans l'arrière-pays niçois que les Alpes prennent leur essor. Vous y trouverez donc de très nombreux villages perchés aggripés aux collines.",
  "alternates": {
    "fr": "/activites/visiter-les-villages-perches/",
    "en": "/en/activites/hilltop-villages/",
    "it": "/it/activites/i-villaggi-collinari/"
  },
  "breadcrumb": [
    {
      "label": "Accueil",
      "href": "/"
    },
    {
      "label": "Activités",
      "href": "/activites-cote-azur/"
    },
    {
      "label": "Les villages perchés"
    }
  ],
  "image": {
    "src": "/media/activites/villages.jpg",
    "alt": "Gourdon, village perché de la Côte d'Azur"
  },
  "paragraphs": [
    "<p>C'est dans l'arrière-pays niçois que les Alpes prennent leur essor. Vous y trouverez donc de très nombreux villages perchés agrippés aux collines. Les plus remarquables sont d'Ouest en Est&nbsp;: Gourdon, Tourrettes-sur-Loup et Eze.</p>",
    "<p>Le nom Gourdon vient du nom Montagne&nbsp;: le village est perché sur le roc à 760m d'altitude, au-dessus de la Vallée du Loup. A seulement 10 kms de la Mer Méditerranée, il offre un panorama unique et impressionnant sur la Côte d'Azur de Nice à Théoule, soit plus de 80km.</p>",
    "<p>Son Château féodal avec sa tour carrée et son donjon est traditionnel de la Provence&nbsp;; les jardins ont été inspirés par Le Nôtre, le célèbre paysagiste du roi Louis XIV.</p>",
    "<p>L'Eglise Saint-Vincent date elle du 13ème siècle et son sol est en pierres d'origine.</p>",
    "<p>Le village, entièrement piéton, vous invite à la découverte de ses ruelles et c'est depuis la place Victoria que vous pourrez admirer le panorama sur la Méditerranée.</p>",
    "<p>Pour parvenir à Gourdon, vous circulerez à travers les Gorges du Loup et pourrez vous arrêter admirer plusieurs cascades, dont celle du Saut du Loup.</p>",
    "<p>Tourrettes-sur-Loup est un village médiéval surnommé la Cité des Violettes. Il y a quelques années, une dizaine de producteurs cultivaient les Violettes utilisées dans l'industrie du parfum à Grasse. La Bastide aux Violettes présente les différentes méthodes de culture et les produits réalisés à partir de cette fleur très parfumée (parfum, confiserie, …).</p>",
    "<p>Également posé sur un éperon rocheux, le village a su conserver son authenticité&nbsp;; il est construit autour du Château.</p>",
    "<p>Une vingtaine d'ateliers et de boutiques d'artisans vous ouvrent leurs portes. Vous y trouverez de la poterie, un artisan travaillant le bois d'olivier, de la maroquinerie, du tissage, …</p>",
    "<p>Construit au bord d'une falaise, surplombant Saint-Jean-Cap-Ferrat, le village d'Eze vous réserve de nombreux trésors cachés, à quelques kilomètres de Monaco.</p>",
    "<p>A l'entrée du village, la poterne du 14ème siècle est creusée dans le mur d'enceinte du Château. Il faut gravir les ruelles en lacets pour parvenir au sommet du village.</p>",
    "<p>Laissez-vous guider par votre instinct pour découvrir des fragments de murs de l'Age de Bronze, des vestiges sur lesquels grimpent des bougainvillées, des rosiers et des jasmins. Vous pourrez voir des bas-reliefs du 13ème siècle, des fontaines, des ferronneries antiques, … La Chapelle des Pénitents Blancs est l'édifice le plus ancien et l'Eglise Notre-Dame-de-l'Assomption vous ouvre ses portes en vous approchant du sommet du village.</p>",
    "<p>Parvenus tout en haut, vous verrez les vestiges du Château et le Jardin Exotique regroupant des centaines de plantes succulentes et de cactus qui trouvent leur place au milieu des ruines arides.</p>"
  ],
  "activityName": "Les villages perchés",
  "backLabel": null,
  "backUrl": null,
  "bookingLabel": null
}
