{
  "key": "/activites/visiter-stpauldevence/",
  "lang": "en",
  "slug": "st-paul-de-vence",
  "route": "/en/activites/st-paul-de-vence",
  "title": "St Paul de Vence — Activities near Mas du Chanoine",
  "description": "St Paul de Vence: discover this activity near our guesthouse on the French Riviera.",
  "alternates": {
    "fr": "/activites/visiter-stpauldevence/",
    "en": "/en/activites/st-paul-de-vence/",
    "it": "/it/activites/saint-paul-de-vence/"
  },
  "breadcrumb": [
    {
      "label": "Home",
      "href": "/en/"
    },
    {
      "label": "Activities",
      "href": "/en/activities-french-riviera/"
    },
    {
      "label": "St Paul de Vence"
    }
  ],
  "image": {
    "src": "/media/activites/saint-paul-de-vence.jpg",
    "alt": "St Paul de Vence"
  },
  "paragraphs": [
    "<p>Recognized as one of the most beautiful villages in France, Saint-Paul de Vence will charm you with its unique atmosphere.</p>",
    "<p>Fortified medieval village, Saint-Paul de Vence is perched on a rocky outcrop and overlooks the Mediterranean Sea. The calm of its alleys and the exceptional light have always attracted and inspired artists from all over the world.</p>",
    "<p>You enter this picturesque pedestrian village by crossing the gate in the ramparts. Stroll through the streets and discover small squares, fountains, art craft workshops… Beside the church, the very famous Folon Chapel, decorated by the Belgian artist will seduce you by its calm and serenity.</p>",
    "<p>The main street is full of galleries featuring all forms of art. A tour of the village along the ramparts will offer you a view of the Mediterranean Sea and the mountains.</p>",
    "<p>Don't forget to visit the world-famous Maeght Foundation dedicated to modern and contemporary art.</p>"
  ],
  "activityName": "St Paul de Vence",
  "backLabel": "← All activities",
  "backUrl": "/en/activities-french-riviera/",
  "bookingLabel": "Book Now"
}
