{
  "key": "/activites/cours-de-cuisine-du-sud/",
  "lang": "fr",
  "slug": "cours-de-cuisine-du-sud",
  "route": "/activites/cours-de-cuisine-du-sud",
  "title": "Cours de cuisine | Mas du chanoine",
  "description": "Cours de cuisine provençale près de Saint-Paul de Vence. Notes de Cuisine, Chef Alain Llorca. Découvrez les saveurs de la Côte d'Azur.",
  "alternates": {
    "fr": "/activites/cours-de-cuisine-du-sud/",
    "en": "/en/activites/cooking-lessons/",
    "it": "/it/activites/corso-di-cucina/"
  },
  "breadcrumb": [
    {
      "label": "Accueil",
      "href": "/"
    },
    {
      "label": "Activités",
      "href": "/activites-cote-azur/"
    },
    {
      "label": "Cours de cuisine"
    }
  ],
  "image": {
    "src": "/media/activites/cuisine.jpg",
    "alt": "Cours de cuisine provençale"
  },
  "paragraphs": [
    "<p>Si vous souhaitez profiter de votre séjour sur la Côte d'Azur pour découvrir la cuisine de Provence, plusieurs solutions s'offrent à vous.</p>",
    "<p>Venez apprendre à cuisiner les produits emblématiques de la Région&nbsp;: courgettes de Nice, tomates, légumes provençaux, poissons de Méditerranée, sans oublier les desserts (bugnes, tarte au citron de Menton, …).</p>",
    "<p>A l'atelier «&nbsp;Notes de Cuisine&nbsp;», Laurence vous accueille en petits groupes pour vous initier à la cuisine du Comté de Nice. Au cœur du village de La Colle Sur Loup, dans une jolie maison en pierres, les cours ont lieu dans sa cuisine équipée de matériel professionnel. Sur son site internet, vous pourrez admirer de magnifiques photos de ses plats (petits farcis niçois, gnocchis, tourte aux blettes, …). Vous pouvez au choix regarder les dates ouvertes sur le planning ou bien la contacter pour une demande personnalisée. <a href=\"https://www.notesdecuisine.fr/\" target=\"_blank\" rel=\"noopener noreferrer\">https://www.notesdecuisine.fr/</a></p>",
    "<p>Le Chef Alain Llorca vous propose de venir dans les cuisines de son restaurant gastronomique (1 étoile au guide Michelin) pour participer à un de ses cours. Il vous fera partager ses trucs et astuces à travers la réalisation d'un menu sur un produit à l'honneur ou sur une thématique spécifique (cuisiner la truffe, menu spécial Pâques, …).</p>",
    "<p>Son frère, le Chef Jean-Michel Llorca, Chef pâtissier du restaurant gastronomique, propose des ateliers gourmands de pâtisserie.</p>",
    "<p>Le planning des cours est en ligne à l'adresse suivante&nbsp;: <a href=\"https://www.alainllorca.com/atelier-degustation/\" target=\"_blank\" rel=\"noopener noreferrer\">https://www.alainllorca.com/atelier-degustation/</a></p>"
  ],
  "activityName": "Cours de cuisine",
  "backLabel": null,
  "backUrl": null,
  "bookingLabel": null
}
