{
  "key": "/activites/visiter-nice/",
  "lang": "en",
  "slug": "nice",
  "route": "/en/activites/nice",
  "title": "Nice — Activities near Mas du Chanoine",
  "description": "Nice: discover this activity near our guesthouse on the French Riviera.",
  "alternates": {
    "fr": "/activites/visiter-nice/",
    "en": "/en/activites/nice/",
    "it": "/it/activites/nizza/"
  },
  "breadcrumb": [
    {
      "label": "Home",
      "href": "/en/"
    },
    {
      "label": "Activities",
      "href": "/en/activities-french-riviera/"
    },
    {
      "label": "Nice"
    }
  ],
  "image": {
    "src": "/media/activites/nice.jpg",
    "alt": "Nice"
  },
  "paragraphs": [
    "<p>Nice, capital of the French Riviera awaits you a quarter of an hour from the Mas du Chanoine. This cosmopolitan city will allow you to stroll, to go shopping, to visit museums.</p>",
    "<p>You can stroll on the very famous Promenade des Anglais and rest on its pretty sandy and pebble beaches, or organize your day according to a theme:</p>",
    "<p>and many more according to your desires.</p>"
  ],
  "activityName": "Nice",
  "backLabel": "← All activities",
  "backUrl": "/en/activities-french-riviera/",
  "bookingLabel": "Book Now"
}
