{
  "key": "/activites/shiatsu/",
  "lang": "fr",
  "slug": "shiatsu",
  "route": "/activites/shiatsu",
  "title": "Shiatsu dans votre chambre d'hôtes | Mas du chanoine",
  "description": "Séances de Shiatsu dans votre chambre au Mas du Chanoine. Détente et relaxation par Nadine, praticienne formée à la médecine chinoise.",
  "alternates": {
    "fr": "/activites/shiatsu/",
    "en": "/en/activites/shiatsu-en/",
    "it": "/it/activites/shiatsu-it/"
  },
  "breadcrumb": [
    {
      "label": "Accueil",
      "href": "/"
    },
    {
      "label": "Activités",
      "href": "/activites-cote-azur/"
    },
    {
      "label": "Shiatsu"
    }
  ],
  "image": {
    "src": "/media/activites/shiatsu.jpg",
    "alt": "Séance de shiatsu"
  },
  "paragraphs": [
    "<p>Le shiatsu est une thérapie manuelle énergétique qui consiste à exercer des pressions des doigts sur les méridiens du corps et à pratiquer des étirements. Tout comme l'acupuncture, il s'appuie sur la médecine traditionnelle chinoise et a des origines japonaises. Il vise à corriger les accumulations ou les manques d'énergies dans certaines zones du corps.</p>",
    "<p>Vous pouvez profiter dans votre chambre d'une séance dispensée par Nadine, formée à la médecine chinoise et à l'acupuncture. Allongé sur une table de massage, cette séance vous permettra de réduire les tensions, de stimuler et renforcer votre système immunitaire&nbsp;; elle vous procurera en outre une détente physique et psychique.</p>",
    "<p>Pour la séance, d'une durée d'une heure, vous serez habillés de vêtements légers. Le montant de la séance sera à régler directement auprès de la praticienne.</p>",
    "<p>Il est fortement conseillé de réserver votre séance de shiatsu avant votre arrivée pour vous assurer de la disponibilité de Nadine.</p>"
  ],
  "activityName": "Shiatsu",
  "backLabel": null,
  "backUrl": null,
  "bookingLabel": null
}
