{
  "key": "/activites/antibes-et-cap-dantibes/",
  "lang": "en",
  "slug": "antibes-and-cap-dantibes",
  "route": "/en/activites/antibes-and-cap-dantibes",
  "title": "Antibes and Cap d'Antibes — Activities near Mas du Chanoine",
  "description": "Antibes and Cap d'Antibes: discover this activity near our guesthouse on the French Riviera.",
  "alternates": {
    "fr": "/activites/antibes-et-cap-dantibes/",
    "en": "/en/activites/antibes-and-cap-dantibes/",
    "it": "/it/activites/antibes-e-cap-dantibes/"
  },
  "breadcrumb": [
    {
      "label": "Home",
      "href": "/en/"
    },
    {
      "label": "Activities",
      "href": "/en/activities-french-riviera/"
    },
    {
      "label": "Antibes and Cap d'Antibes"
    }
  ],
  "image": {
    "src": "/media/activites/antibes.jpg",
    "alt": "Antibes and Cap d'Antibes"
  },
  "paragraphs": [
    "<p>Halfway between Nice and Cannes, the seaside resort of Antibes Juan les Pins has long sandy beaches where you can practice all water sports.</p>",
    "<p>Start your day with a visit to the old town. Every morning, Cours Massena hosts a market with local products. Nearby is Vauban Harbor where you can admire sailing boats, yachts and the most luxurious ships in the world.</p>",
    "<p>On the Art side, the Picasso Museum occupies the Grimaldi Castle, a magnificent medieval building.</p>",
    "<p>In the early afternoon, discover Cap d'Antibes. You can hike along the \"Tirepoil\" coastal path to the Lighthouse. You can see Villa Eilenroc as well as huge properties with lush gardens. It is also in the bay of La Garoupe that you can choose to swim or spend a relaxing day on a private beach.</p>"
  ],
  "activityName": "Antibes and Cap d'Antibes",
  "backLabel": "← All activities",
  "backUrl": "/en/activities-french-riviera/",
  "bookingLabel": "Book Now"
}
