{
  "key": "/activites/shiatsu/",
  "lang": "en",
  "slug": "shiatsu-en",
  "route": "/en/activites/shiatsu-en",
  "title": "Shiatsu — Activities near Mas du Chanoine",
  "description": "Shiatsu: discover this activity near our guesthouse on the French Riviera.",
  "alternates": {
    "fr": "/activites/shiatsu/",
    "en": "/en/activites/shiatsu-en/",
    "it": "/it/activites/shiatsu-it/"
  },
  "breadcrumb": [
    {
      "label": "Home",
      "href": "/en/"
    },
    {
      "label": "Activities",
      "href": "/en/activities-french-riviera/"
    },
    {
      "label": "Shiatsu"
    }
  ],
  "image": {
    "src": "/media/activites/shiatsu.jpg",
    "alt": "Shiatsu"
  },
  "paragraphs": [
    "<p>Shiatsu is an energetic manual therapy that involves applying finger pressure to the body's meridians and stretching. It is based on traditional Chinese medicine and has Japanese origins.</p>",
    "<p>You can enjoy in your room a session provided by Nadine, trained in Chinese medicine and acupuncture. Lying on a massage table, this session will help you reduce tension, stimulate and strengthen your immune system.</p>",
    "<p>For the session, lasting one hour, you will be dressed in light clothing. It is strongly recommended that you book your Shiatsu session before your arrival.</p>"
  ],
  "activityName": "Shiatsu",
  "backLabel": "← All activities",
  "backUrl": "/en/activities-french-riviera/",
  "bookingLabel": "Book Now"
}
