{
  "key": "/activites/golf/",
  "lang": "fr",
  "slug": "golf",
  "route": "/activites/golf",
  "title": "Golfer sur la Cote d'azur | Mas du chanoine",
  "description": "Golf sur la Côte d'Azur. 10 parcours 18 trous et 6 de 9 trous dans un rayon de 15 km autour du Mas du Chanoine à Saint-Paul de Vence.",
  "alternates": {
    "fr": "/activites/golf/",
    "en": "/en/activites/golf-en/",
    "it": "/it/activites/golf-3/"
  },
  "breadcrumb": [
    {
      "label": "Accueil",
      "href": "/"
    },
    {
      "label": "Activités",
      "href": "/activites-cote-azur/"
    },
    {
      "label": "Golf"
    }
  ],
  "image": {
    "src": "/media/activites/golf.jpg",
    "alt": "Golf sur la Côte d'Azur"
  },
  "paragraphs": [
    "<p>La Côte d'Azur est une destination idéale pour les amateurs de golf. En effet, pas moins de 10 parcours de golf 18 trous et 6 de 9 trous sont accessibles dans un rayon de 15 km autour du Mas du Chanoine.</p>",
    "<p>Les parcours sont variés par leur tracé, leur emplacement (proche de la Mer Méditerranée ou plus dans les terres) et leur difficulté. Ils sont très verdoyants et peuvent offrir un panorama exceptionnel comme le Monte-Carlo Golf Club.</p>",
    "<p>Vous pourrez également choisir des golfs de niveau international connus des meilleurs joueurs du Monde, comme le Golf Country Club de Cannes Mougins.</p>",
    "<p><strong>Deux golfs proposent un parcours 18 trous et un parcours 9 trous&nbsp;:</strong></p>",
    "<p><strong>Golfs proposant un parcours 18 trous&nbsp;:</strong></p>",
    "<p><strong>Golfs proposant un parcours 9 trous&nbsp;:</strong></p>"
  ],
  "activityName": "Golf",
  "backLabel": null,
  "backUrl": null,
  "bookingLabel": null
}
